title,release date,director,genre
Star Wars Episode IV: A New Hope,1977-05-25,George Lucas,Science Fiction
Star Wars Episode V: The Empire Strikes Back,1980-05-21,George Lucas,Science Fiction
Star Wars Episode VI: Return of the Jedi,1983-05-25,George Lucas,Science Fiction
Star Wars Episode I: The Phantom Menace,1999-05-19,George Lucas,Science Fiction
Star Wars Episode II: Attack of the Clones,2002-05-16,George Lucas,Science Fiction
Star Wars Episode III: Revenge of the Sith,2005-05-19,George Lucas,Science Fiction
Ghostbusters,1984-06-07,Ivan Reitman,Comedy
Back To The Future,1985-07-03,Robert Zemeckis,Science Fiction
The Matrix,1999-03-31,Wachowskis,Action